question,ground_truth,answer,contexts,context_precision,context_recall,faithfulness,answer_relevancy
"context: Student Name: Stephanie Acosta. Student ID: STU073. Email: abigailtorres@yahoo.com. Date of Birth: 2000-10-09. Department: Electrical. Achievement: Research - Fine rate a.: Why great amount camera skill indeed.. Status: Approved. Approved By: Mark Johnson. Credits Awarded: 5
keyphrase: Student ID
question: ""What is the unique identifier assigned to Stephanie Acosta?",The unique identifier assigned to Stephanie Acosta is STU073.,The unique identifier assigned to Stephanie Acosta is **STU073**.,"['Student Name: Stephanie Acosta. Student ID: STU073. Email: abigailtorres@yahoo.com. Department: Electrical. Achievement: Research - Fine rate a.: Why great amount camera skill indeed.'
 'Student Name: Stephanie Acosta. Student ID: STU073. Email: abigailtorres@yahoo.com. Department: Electrical. Achievement: Leadership - Affect above democratic.: Sport something to fill. Risk fact human American.\nWhen another off last increase time book just.'
 'Student Name: Daniel Smith. Student ID: STU060. Email: james30@guzman.com. Department: Electronics. Achievement: Workshop - Exactly crime however window ground.: Leg character be bank consider determine behind. Join city once speech seat.'
 'Student Name: Laura Valentine. Student ID: STU045. Email: thomas72@yahoo.com. Department: Electronics. Achievement: Hackathon - Rock these though.: Country with simply light former card quite laugh. Do future down between identify bill.'
 'Student Name: Shawn Smith. Student ID: STU069. Email: carloshuynh@yahoo.com. Department: Mechanical. Achievement: Certification - Year stay.: Imagine job require response. Specific beat new billion exist yet them.'
 'Student Name: Sara Chaney. Student ID: STU064. Email: lorimorris@smith.com. Department: Electronics. Achievement: Certification - Fill day camera.: High those eat this help. Again threat yard might.'
 'Student Name: Stephanie Delacruz. Student ID: STU093. Email: bradley08@hotmail.com. Department: Electronics. Achievement: Hackathon - Game far.: Always my material marriage must owner treat. Cell ok position lawyer attorney unit plant up.'
 'Student Name: Andrew White. Student ID: STU052. Email: htucker@norton-schmidt.org. Department: Physics. Achievement: Leadership - Close participant radio direction.: Else explain myself military still. Item kitchen wear whatever. Specific Democrat source.']",0.9999999999875,1.0,1.0,0.6972429500090144
"context: Student Name: Stephanie Acosta. Student ID: STU073. Email: abigailtorres@yahoo.com. Date of Birth: 2000-10-09. Department: Electrical. Achievement: Research - Fine rate a.: Why great amount camera skill indeed.. Status: Approved. Approved By: Mark Johnson. Credits Awarded: 5
keyphrase: Student ID
question: ""What is the unique identifier assigned to Stephanie Acosta?",The unique identifier assigned to Stephanie Acosta is STU073.,The unique identifier assigned to Stephanie Acosta is **STU073**.,"['Student Name: Stephanie Acosta. Student ID: STU073. Email: abigailtorres@yahoo.com. Department: Electrical. Achievement: Research - Fine rate a.: Why great amount camera skill indeed.'
 'Student Name: Stephanie Acosta. Student ID: STU073. Email: abigailtorres@yahoo.com. Department: Electrical. Achievement: Leadership - Affect above democratic.: Sport something to fill. Risk fact human American.\nWhen another off last increase time book just.'
 'Student Name: Daniel Smith. Student ID: STU060. Email: james30@guzman.com. Department: Electronics. Achievement: Workshop - Exactly crime however window ground.: Leg character be bank consider determine behind. Join city once speech seat.'
 'Student Name: Laura Valentine. Student ID: STU045. Email: thomas72@yahoo.com. Department: Electronics. Achievement: Hackathon - Rock these though.: Country with simply light former card quite laugh. Do future down between identify bill.'
 'Student Name: Shawn Smith. Student ID: STU069. Email: carloshuynh@yahoo.com. Department: Mechanical. Achievement: Certification - Year stay.: Imagine job require response. Specific beat new billion exist yet them.'
 'Student Name: Sara Chaney. Student ID: STU064. Email: lorimorris@smith.com. Department: Electronics. Achievement: Certification - Fill day camera.: High those eat this help. Again threat yard might.'
 'Student Name: Stephanie Delacruz. Student ID: STU093. Email: bradley08@hotmail.com. Department: Electronics. Achievement: Hackathon - Game far.: Always my material marriage must owner treat. Cell ok position lawyer attorney unit plant up.'
 'Student Name: Andrew White. Student ID: STU052. Email: htucker@norton-schmidt.org. Department: Physics. Achievement: Leadership - Close participant radio direction.: Else explain myself military still. Item kitchen wear whatever. Specific Democrat source.']",0.9999999999875,1.0,1.0,0.6972429500090144
